{
  "schema_version": "1.0",
  "snapshot": {
    "id": "m2-scenario-a-feasible",
    "captured_at": "2026-10-10T09:00:00Z",
    "source_type": "synthetic_fixture",
    "kubernetes_version": "v1.34.1",
    "description": "All candidates fit jointly on eligible destinations.",
    "inventory": {
      "nodes": "complete",
      "pods": "complete",
      "pod_disruption_budgets": "complete",
      "notes": "Synthetic fixture. All names, UIDs and images are invented."
    }
  },
  "target_node": "worker-03",
  "nodes": [
    {
      "apiVersion": "v1",
      "kind": "Node",
      "metadata": {
        "name": "worker-01",
        "uid": "b0000000-0000-4000-8000-000000001001",
        "labels": {
          "kubernetes.io/hostname": "worker-01",
          "kubernetes.io/os": "linux",
          "kubernetes.io/arch": "amd64"
        }
      },
      "spec": {},
      "status": {
        "capacity": {
          "cpu": "4",
          "memory": "8Gi",
          "pods": "110"
        },
        "allocatable": {
          "cpu": "4",
          "memory": "8Gi",
          "pods": "110"
        },
        "conditions": [
          {
            "type": "Ready",
            "status": "True",
            "reason": "KubeletReady"
          }
        ],
        "nodeInfo": {
          "kubeletVersion": "v1.34.1"
        }
      }
    },
    {
      "apiVersion": "v1",
      "kind": "Node",
      "metadata": {
        "name": "worker-02",
        "uid": "b0000000-0000-4000-8000-000000001002",
        "labels": {
          "kubernetes.io/hostname": "worker-02",
          "kubernetes.io/os": "linux",
          "kubernetes.io/arch": "amd64"
        }
      },
      "spec": {},
      "status": {
        "capacity": {
          "cpu": "4",
          "memory": "8Gi",
          "pods": "110"
        },
        "allocatable": {
          "cpu": "4",
          "memory": "8Gi",
          "pods": "110"
        },
        "conditions": [
          {
            "type": "Ready",
            "status": "True",
            "reason": "KubeletReady"
          }
        ],
        "nodeInfo": {
          "kubeletVersion": "v1.34.1"
        }
      }
    },
    {
      "apiVersion": "v1",
      "kind": "Node",
      "metadata": {
        "name": "worker-03",
        "uid": "b0000000-0000-4000-8000-000000001003",
        "labels": {
          "kubernetes.io/hostname": "worker-03",
          "kubernetes.io/os": "linux",
          "kubernetes.io/arch": "amd64"
        }
      },
      "spec": {},
      "status": {
        "capacity": {
          "cpu": "4",
          "memory": "8Gi",
          "pods": "110"
        },
        "allocatable": {
          "cpu": "4",
          "memory": "8Gi",
          "pods": "110"
        },
        "conditions": [
          {
            "type": "Ready",
            "status": "True",
            "reason": "KubeletReady"
          }
        ],
        "nodeInfo": {
          "kubeletVersion": "v1.34.1"
        }
      }
    }
  ],
  "pods": [
    {
      "apiVersion": "v1",
      "kind": "Pod",
      "metadata": {
        "namespace": "shop",
        "name": "web-5d4c3b-aaaaa",
        "uid": "a0000000-0000-4000-8000-000000001005",
        "labels": {
          "app": "web"
        },
        "ownerReferences": [
          {
            "apiVersion": "apps/v1",
            "kind": "ReplicaSet",
            "name": "web-5d4c3b",
            "uid": "c0000000-0000-4000-8000-000000001004",
            "controller": true,
            "blockOwnerDeletion": true
          }
        ]
      },
      "spec": {
        "containers": [
          {
            "name": "web",
            "image": "registry.example.invalid/web:1.0",
            "resources": {
              "requests": {
                "cpu": "1",
                "memory": "2Gi"
              }
            }
          }
        ],
        "schedulerName": "default-scheduler",
        "restartPolicy": "Always",
        "nodeName": "worker-01"
      },
      "status": {
        "phase": "Running"
      }
    },
    {
      "apiVersion": "v1",
      "kind": "Pod",
      "metadata": {
        "namespace": "shop",
        "name": "web-5d4c3b-bbbbb",
        "uid": "a0000000-0000-4000-8000-000000001007",
        "labels": {
          "app": "web"
        },
        "ownerReferences": [
          {
            "apiVersion": "apps/v1",
            "kind": "ReplicaSet",
            "name": "web-5d4c3b",
            "uid": "c0000000-0000-4000-8000-000000001006",
            "controller": true,
            "blockOwnerDeletion": true
          }
        ]
      },
      "spec": {
        "containers": [
          {
            "name": "web",
            "image": "registry.example.invalid/web:1.0",
            "resources": {
              "requests": {
                "cpu": "1",
                "memory": "2Gi"
              }
            }
          }
        ],
        "schedulerName": "default-scheduler",
        "restartPolicy": "Always",
        "nodeName": "worker-03"
      },
      "status": {
        "phase": "Running"
      }
    },
    {
      "apiVersion": "v1",
      "kind": "Pod",
      "metadata": {
        "namespace": "shop",
        "name": "api-6e5d4c-aaaaa",
        "uid": "a0000000-0000-4000-8000-000000001009",
        "labels": {
          "app": "api"
        },
        "ownerReferences": [
          {
            "apiVersion": "apps/v1",
            "kind": "ReplicaSet",
            "name": "api-6e5d4c",
            "uid": "c0000000-0000-4000-8000-000000001008",
            "controller": true,
            "blockOwnerDeletion": true
          }
        ]
      },
      "spec": {
        "containers": [
          {
            "name": "api",
            "image": "registry.example.invalid/api:1.0",
            "resources": {
              "requests": {
                "cpu": "800m",
                "memory": "1Gi"
              }
            }
          }
        ],
        "schedulerName": "default-scheduler",
        "restartPolicy": "Always",
        "nodeName": "worker-03"
      },
      "status": {
        "phase": "Running"
      }
    },
    {
      "apiVersion": "v1",
      "kind": "Pod",
      "metadata": {
        "namespace": "shop",
        "name": "cache-0",
        "uid": "a0000000-0000-4000-8000-000000001011",
        "labels": {
          "app": "cache"
        },
        "ownerReferences": [
          {
            "apiVersion": "apps/v1",
            "kind": "StatefulSet",
            "name": "cache",
            "uid": "c0000000-0000-4000-8000-000000001010",
            "controller": true,
            "blockOwnerDeletion": true
          }
        ]
      },
      "spec": {
        "containers": [
          {
            "name": "cache",
            "image": "registry.example.invalid/cache:1.0",
            "resources": {
              "requests": {
                "cpu": "500m",
                "memory": "3Gi"
              }
            }
          }
        ],
        "schedulerName": "default-scheduler",
        "restartPolicy": "Always",
        "nodeName": "worker-03"
      },
      "status": {
        "phase": "Running"
      }
    }
  ],
  "pod_disruption_budgets": []
}
