{
  "schema_version": "1.0",
  "snapshot": {
    "id": "m2-scenario-c-aggregate-shortage",
    "captured_at": "2026-10-10T09:00:00Z",
    "source_type": "synthetic_fixture",
    "kubernetes_version": "v1.34.1",
    "description": "Each pod fits any destination alone; only two of three fit together.",
    "inventory": {
      "nodes": "complete",
      "pods": "complete",
      "pod_disruption_budgets": "complete",
      "notes": "Synthetic fixture. All names, UIDs and images are invented."
    }
  },
  "target_node": "source",
  "nodes": [
    {
      "apiVersion": "v1",
      "kind": "Node",
      "metadata": {
        "name": "node-1",
        "uid": "b0000000-0000-4000-8000-000000001201",
        "labels": {
          "kubernetes.io/hostname": "node-1",
          "kubernetes.io/os": "linux",
          "kubernetes.io/arch": "amd64"
        }
      },
      "spec": {},
      "status": {
        "capacity": {
          "cpu": "2",
          "memory": "4Gi",
          "pods": "110"
        },
        "allocatable": {
          "cpu": "2",
          "memory": "4Gi",
          "pods": "110"
        },
        "conditions": [
          {
            "type": "Ready",
            "status": "True",
            "reason": "KubeletReady"
          }
        ],
        "nodeInfo": {
          "kubeletVersion": "v1.34.1"
        }
      }
    },
    {
      "apiVersion": "v1",
      "kind": "Node",
      "metadata": {
        "name": "node-2",
        "uid": "b0000000-0000-4000-8000-000000001202",
        "labels": {
          "kubernetes.io/hostname": "node-2",
          "kubernetes.io/os": "linux",
          "kubernetes.io/arch": "amd64"
        }
      },
      "spec": {},
      "status": {
        "capacity": {
          "cpu": "2",
          "memory": "4Gi",
          "pods": "110"
        },
        "allocatable": {
          "cpu": "2",
          "memory": "4Gi",
          "pods": "110"
        },
        "conditions": [
          {
            "type": "Ready",
            "status": "True",
            "reason": "KubeletReady"
          }
        ],
        "nodeInfo": {
          "kubeletVersion": "v1.34.1"
        }
      }
    },
    {
      "apiVersion": "v1",
      "kind": "Node",
      "metadata": {
        "name": "source",
        "uid": "b0000000-0000-4000-8000-000000001203",
        "labels": {
          "kubernetes.io/hostname": "source",
          "kubernetes.io/os": "linux",
          "kubernetes.io/arch": "amd64"
        }
      },
      "spec": {},
      "status": {
        "capacity": {
          "cpu": "8",
          "memory": "16Gi",
          "pods": "110"
        },
        "allocatable": {
          "cpu": "8",
          "memory": "16Gi",
          "pods": "110"
        },
        "conditions": [
          {
            "type": "Ready",
            "status": "True",
            "reason": "KubeletReady"
          }
        ],
        "nodeInfo": {
          "kubeletVersion": "v1.34.1"
        }
      }
    }
  ],
  "pods": [
    {
      "apiVersion": "v1",
      "kind": "Pod",
      "metadata": {
        "namespace": "apps",
        "name": "worker-9c8d7e-aaaaa",
        "uid": "a0000000-0000-4000-8000-000000001205",
        "labels": {
          "app": "worker"
        },
        "ownerReferences": [
          {
            "apiVersion": "apps/v1",
            "kind": "ReplicaSet",
            "name": "worker-9c8d7e",
            "uid": "c0000000-0000-4000-8000-000000001204",
            "controller": true,
            "blockOwnerDeletion": true
          }
        ]
      },
      "spec": {
        "containers": [
          {
            "name": "worker",
            "image": "registry.example.invalid/worker:1.0",
            "resources": {
              "requests": {
                "cpu": "1500m",
                "memory": "1Gi"
              }
            }
          }
        ],
        "schedulerName": "default-scheduler",
        "restartPolicy": "Always",
        "nodeName": "source"
      },
      "status": {
        "phase": "Running"
      }
    },
    {
      "apiVersion": "v1",
      "kind": "Pod",
      "metadata": {
        "namespace": "apps",
        "name": "worker-9c8d7e-bbbbb",
        "uid": "a0000000-0000-4000-8000-000000001207",
        "labels": {
          "app": "worker"
        },
        "ownerReferences": [
          {
            "apiVersion": "apps/v1",
            "kind": "ReplicaSet",
            "name": "worker-9c8d7e",
            "uid": "c0000000-0000-4000-8000-000000001206",
            "controller": true,
            "blockOwnerDeletion": true
          }
        ]
      },
      "spec": {
        "containers": [
          {
            "name": "worker",
            "image": "registry.example.invalid/worker:1.0",
            "resources": {
              "requests": {
                "cpu": "1500m",
                "memory": "1Gi"
              }
            }
          }
        ],
        "schedulerName": "default-scheduler",
        "restartPolicy": "Always",
        "nodeName": "source"
      },
      "status": {
        "phase": "Running"
      }
    },
    {
      "apiVersion": "v1",
      "kind": "Pod",
      "metadata": {
        "namespace": "apps",
        "name": "worker-9c8d7e-ccccc",
        "uid": "a0000000-0000-4000-8000-000000001209",
        "labels": {
          "app": "worker"
        },
        "ownerReferences": [
          {
            "apiVersion": "apps/v1",
            "kind": "ReplicaSet",
            "name": "worker-9c8d7e",
            "uid": "c0000000-0000-4000-8000-000000001208",
            "controller": true,
            "blockOwnerDeletion": true
          }
        ]
      },
      "spec": {
        "containers": [
          {
            "name": "worker",
            "image": "registry.example.invalid/worker:1.0",
            "resources": {
              "requests": {
                "cpu": "1500m",
                "memory": "1Gi"
              }
            }
          }
        ],
        "schedulerName": "default-scheduler",
        "restartPolicy": "Always",
        "nodeName": "source"
      },
      "status": {
        "phase": "Running"
      }
    }
  ],
  "pod_disruption_budgets": []
}
